{
  "schema_version": 1,
  "kind": "load",
  "status": "completed",
  "created_at": "2026-10-04T01:43:56.614530+00:00",
  "metadata": {
    "declared_scope": "demo",
    "warmup_seconds": 1.0,
    "requested_users": 2,
    "identity_token_count": 1,
    "scenario_ids": [
      "classroom",
      "multitool",
      "courses",
      "secondhand",
      "rag"
    ],
    "locust_version": "2.43.2",
    "redis_session_ttl_context": 259200,
    "cpu_ram_monitor_enabled": false,
    "purpose": "demo_connectivity_smoke"
  },
  "measurement_seconds": 6.848700284957886,
  "metrics": {
    "requests_total": 14,
    "requests_successful": 14,
    "requests_failed": 0,
    "success_rate": 1.0,
    "completed_chat_rps": 2.0441834826308347,
    "e2e_p50_ms": 8.46382800000356,
    "e2e_p95_ms": 12.437575850026406,
    "e2e_p99_ms": 13.44703676994868,
    "gpu_0_peak_gib": null,
    "gpu_1_peak_gib": null,
    "ttft_p95_ms": null,
    "model_queue_peak": null
  },
  "http_status_counts": {
    "200": 14
  },
  "observed_response_modes": {
    "demo": 14
  },
  "latency_samples_retained": 14,
  "latency_samples_dropped": 0,
  "limitations": [
    "Counts all measured chat completions; semantic failure counts as failure even with HTTP 200.",
    "Warmup excluded by request start timestamp; measurement includes any shutdown drain.",
    "Closed-loop concurrent clients, not a controlled open arrival rate.",
    "GPU/queue/TTFT are not collected by this script and remain null.",
    "If latency cap is exceeded, percentiles are withheld.",
    "Declared demo/model scope is a label; observed modes do not prove specific hardware."
  ]
}
